{
  "claim_id": "CLM-001-001",
  "benchmark_version": "0.1.0",
  "schema_version": "0.1",
  "claim_type": "REACHABILITY",
  "statement": "An attacker-controlled URL reaches the outbound HTTP client, but the effective destination allowlist blocks unauthorized destinations.",
  "subject": "attacker",
  "predicate": "security_condition",
  "object": "Effective security control blocks the candidate path.",
  "confidence": 1,
  "status": "SUPPORTED",
  "related_evidence": [
    "EVD-001-001"
  ],
  "provenance": "VERIFIED"
}
