{
  "claim_id": "CLM-004-001",
  "benchmark_version": "0.1.0",
  "schema_version": "0.1",
  "claim_type": "DATA_FLOW",
  "statement": "HTTP input is persisted and later consumed by a worker that interprets it as a command.",
  "subject": "HTTP input",
  "predicate": "flows through",
  "object": "persistent worker to command sink",
  "confidence": 1,
  "status": "SUPPORTED",
  "related_evidence": [
    "EVD-004-001"
  ],
  "provenance": "VERIFIED"
}
