{
  "claim_id": "CLM-008-001",
  "benchmark_version": "0.1.0",
  "schema_version": "0.1",
  "claim_type": "CONTROL_EFFECTIVE",
  "statement": "The sandbox blocks ordinary prompts, but a documented namespace-escape prerequisite makes the impact conditionally reachable.",
  "subject": "attacker",
  "predicate": "security_condition",
  "object": "The path is reachable only when the explicit prerequisite is satisfied.",
  "confidence": 1,
  "status": "SUPPORTED",
  "related_evidence": [
    "EVD-008-001"
  ],
  "provenance": "VERIFIED"
}
